product_id,quantity,product_name,brand,Price,category
37,34,"La Roche-Posay Lipikar AP+ Triple Repair Moisturizing Cream | Face & Body Lotion For Dry Skin | Shea Butter & Niacinamide Moisturizer | Gentle Face & Body Cream For Dry, Rough & Sensitive Skin",La Roche-Posay,19.,5
38,26,"La Roche-Posay Lipikar Daily Repair Moisturizing Cream, Fragrance Free Body Moisturizer with Shea Butter, Body Lotion for Dry Skin, Moisturizing for Sensitive Skin",N/A,19.,5
39,3,"Eau Thermale Avène XeraCalm A.D Lipid-Replenishing Cleansing Oil, Atopic Dermatitis, Eczema-Prone, Fragrance-Free, Pump, 13.5 oz.",N/A,34.,5
40,4,"Eau Thermale Avène Xercalm A.D Ultra-Rich Cleansing Bar for Atopic Dermatitis, Eczema Prone Skin, Fragrance-Free, 100 g",N/A,14.,5
41,81,"CONTROL CORRECTIVE SKIN CARE SYSTEMS O2 Med, 1.7 oz",N/A,25.,5
42,60,"BODY OS-01 Peptide Skin Longevity Daily Moisturizer- Improves Skin Texture & Barrier, For All Skin Types Including Sensitive Skin",OneSkin,99.,5
43,16,"Replenix Glycolic Acid 15% Resurfacing Body Lotion, Medical-Grade Brightening & Hydrating Exfoliating Cream for Skin Discoloration & Rough Texture (6.7 fl. oz)",N/A,46.,5
44,75,Eau Thermale Avene XeraCalm NUTRITION Shower Cream,N/A,32.,5
